{
  "schema": "codebase-build.context-retrieval-receipt",
  "version": 1,
  "receipt_type": "retrieval",
  "claim_id": "fixture-context-ready",
  "lane": "governance",
  "query": "projection ownership",
  "created_at": "2026-09-03T00:00:00.000Z",
  "route": {
    "scheme": "http",
    "host": "provider.invalid:8080",
    "path": "/mcp"
  },
  "worktree": {
    "project_root": "/tmp/project",
    "head": "0123456789abcdef0123456789abcdef01234567",
    "dirty_digest": "sha256:0000000000000000000000000000000000000000000000000000000000000000"
  },
  "ok": true,
  "state": "CONTEXT_READY",
  "execution": "EXECUTED",
  "transport": "mcp",
  "query_outcome": "HIT_READ",
  "provider": {
    "name": "fixture-provider",
    "version": "1.0.0"
  },
  "search": {
    "tool": "find",
    "candidate_uris": [
      "memory://resources/project/first.md"
    ]
  },
  "read": {
    "uri": "memory://resources/project/first.md",
    "bytes": 21,
    "content_digest": "sha256:6a689d949a2e66bd8f9418be38cf7eb089ef28010f7f558f6895ce948e832152"
  },
  "error": null,
  "digest": "sha256:3473e951add322959cf24510334c60a317016c48e460c173c0416c2cd3a21467"
}
